sku,sku_name,brand,buyer,category,objetivo_mensual_gmv,stock_actual
DREAMERTWO,Colchon en Caja Básico Matrimonial 135x190 DreamerTwo ColorDreams,bla,gris,Colchones,4152000,1912
KHCESPMG,Colchon Matrimonial En Caja 15cm Alto KingsHouse,bla,gris,Colchones,3298500,1168
KING3000,Generador Portatil a Gasolina 3000w 7.5 H.P 110v/220v KING3000 Kingsman,cri,gris,Ferretería,2489400,331
KHCESPIB,Colchon Individual En Caja 15cm Alto KingsHouse,cri,blue,Colchones,2463240,961
DREAMERONE,Colchon en Caja Básico Individual 100x190 DreamerOne ColorDreams,bla,gris,Colchones,2338800,2176
RUMG40,Set de 4 Maletas Rigídas ABS Rumbo,bla,gris,Equipaje y bolsas,2308900,773
COUPLEDREAMER,Colchon en Caja Premium Matrimonial 135x190 CoupleDreamer ColorDreams,bla,gris,Colchones,2171950,314
EX-1BNW,Bicicleta Eléctrica Con Canastilla Delantera Bocina Luz y Señales Intermitentes,bla,gris,Deportes,1899800,299
KHCESPIG,Colchon Individual En Caja 15cm Alto KingsHouse,bla,gris,Colchones,1894800,536
56677-BEST,Alberca Estructural Redonda Steel Pro 305cm Familiar Bestway,bla,gris,Jardín,1869150,301
KHCESPMB,Colchon Matrimonial En Caja 15cm Alto KingsHouse,bla,gris,Colchones,1759200,763
EX-1B,Bicicleta Eléctrica Con Canastilla Delantera Bocina Luz y Señales Intermitentes,bla,gris,Deportes,1709820,225
CENEVO1,Caminadora Electrica Portatil Nevo 1 HP,bla,gris,Deportes,1589470,962
BATH-VA1-BLA,Mueble Kit Para Baño Gabinete Organizador Lavamano Monomando,bla,gris,Muebles,1430470,316
RUMG30,Juego 3 Maletas de Viaje Rigidas Ruedas,bla,gris,Equipaje y bolsas,1329300,806
RUM30,Set de 3 Maletas Rigídas ABS Negro,bla,gris,Equipaje y bolsas,1272330,397
153812,Hielera 48 Qt O 45 Lit Azul Con Asas Tapa Enfriador Coleman,bla,gris,Jardín,1249200,995
LIV-GARDEN4-MAR,Sala Para Exterior Rattan Con Cojines Garden,bla,gris,Muebles,1207150,264
LIV-GARDEN4-NEG,Sala Para Exterior Rattan Con Cojines Garden,bla,gris,Muebles,1207150,538
EBIKE350-B,Bicicleta Eléctrica con canastilla delantera batería 350W,bla,gris,Deportes,1184850,24
RUM40,Set de 4 Maletas Rigídas ABS Rumbo,bla,gris,Equipaje y bolsas,1154450,31
KINGDREAMER,Colchon en Caja Premium King 200x190 KingDreamer ColorDreams,bla,gris,Colchones,1119800,241
HIDROKING2000,Hidrolavadora Eléctrica Portatil 2000 Psi 1600w + Accesorios,bla,gris,Ferretería,1019400,1597
SINGLEDREAMER,Colchon en Caja Premium Individual 100x190 SingleDreamer ColorDreams,bla,gris,Colchones,1014650,410
KINGCEM5,Caminadora Electrica Monitor KingSports,bla,gris,Deportes,965770,0
QUEENDREAMER,Colchon Queen Size En Caja Memory 150x190x23 Cm Colordreams,bla,gris,Colchones,849830,415
CP3DREAM135,Colchon plegable en 3 partes 135cm COLORDREAMS,bla,gris,Colchones,759600,357
BATH-VA1-MAD,Mueble Gabinete Para Baño Con Ovalin y Monomando Caja 2,bla,gris,Muebles,755720,460
KHSPRING1B,Colchon 16cm resortes Individual Blanco,bla,gris,Colchones,755580,425
KINGCEP2,Caminadora Electrica Plegable Color Negro Kingsports,bla,gris,Deportes,719820,2
KH4PLSR,Sala para Exteriores Jardin de Mimbre Negro Cojines Beige,bla,gris,Muebles,701820,305
DRESMULTI4-BLA,Mueble Armario Ropero Closet Multiusos 4 Puertas Mdp,bla,gris,Muebles,671790,400
DRESMULTI4-CAO,Mueble Armario Ropero Closet Multiusos 4 Puertas Mdp,bla,gris,Muebles,671790,352
KINGDIPLA400,Diablito Carga Plataforma Rueda Neumatica 400kg Diablo Acero,bla,gris,Ferretería,661500,343
CENEVO4,Caminadora Electrica Portatil Plegable Nevo 1.3 HP,bla,gris,Deportes,659800,140
KIND5200,Desbrozadora Desmalezadora 52cc Motor 2 tiempos 2.5 HP + Carrete Hilo Amarillo KIND5200 Kingsman,bla,gris,Ferretería,659600,82
KHSPRING2B,Colchon 16cm resortes Matrimonial Blanco,bla,gris,Colchones,650690,225
KHCESP12MB,Colchón Colchoneta Matrimonial En Caja Espuma Memory Foam,bla,gris,Colchones,639680,336
KHSOFABEDGC,Sofa Cama Contemporaneo KingsHouse,bla,gris,Muebles,626780,73
DNG-GLAZI6-NEG,Juego De Comedor Mesa Con 6 Sillas Glazia Caja 1,bla,gris,Muebles,619900,65
CP3DREAM100,Colchon plegable en 3 partes 100cm COLORDREAMS,bla,gris,Colchones,619600,834
SH18-MAD,Mueble Zapatero MDP Para 18 Pares,bla,gris,Muebles,591680,99
SH18-BLA,Mueble Zapatero MDP Para 18 Pares,bla,gris,Muebles,591680,355
DUOSPRING20,Colchon 20cm resortes pocket coil Matrimonial Spring Series ColorDreams,bla,gris,Colchones,569850,444
KHCESP12SB,Colchón Colchoneta Individual En Caja 80x190 Espuma Memory,bla,gris,Colchones,559600,297
CP3DREAM80,Colchon plegable en 3 partes 80cm COLORDREAMS,bla,gris,Colchones,545580,509
KHSOFARG,Sillon Reclinable Contemporaneo,bla,gris,Muebles,539880,104
KH3PLBB,SALA ESQUINA IZQUIERDA PARA EXTERIORES JARDIN RATTAN,bla,gris,Jardín,529900,390
KH3PLBBL,SALA ESQUINA DERECHA PARA EXTERIORES JARDIN RATTAN,bla,gris,Jardín,529900,287
KH3PLGB,SALA ESQUINA IZQUIERDA PARA EXTERIORES JARDIN RATTAN,bla,gris,Jardín,529900,339
KH3PLGBL,SALA ESQUINA DERECHA PARA EXTERIORES JARDIN RATTAN,bla,gris,Jardín,529900,315
ETRAIL-6B,Bicicleta Electrica Con Batería De 350W ETRAIL R29 Neon,bla,gris,Deportes,508455,81
ETRAIL-6G,Bicicleta Electrica Con Batería De 350W ETRAIL R29 Neon,bla,gris,Deportes,508455,57
HIDROKING2200RC,Hidrolavadora Eléctrica Portatil 2200 Psi 2000w + Accesorios,bla,gris,Ferretería,499750,830
KINGCEB3,Caminadora Electrica Plegable Color Negro Kingsports,bla,gris,Deportes,499681,20
KHSOFARB,Sillon Reclinable Contemporaneo,bla,gris,Muebles,494890,391
FWL30,Ventilador De Pared Industrial 30 Pulgadas Aluminio Kingsman,bla,gris,Electrodomésticos,482790,8
TOPPER2M,Colchoneta Topper Cubrecolchon Matrimonial 5cm,bla,gris,Colchones,477950,2124
KINGSPRING,Colchon 30cm resortes pocket coil King Spring Series ColorDreams,bla,gris,Colchones,468930,108
XTRAIL-2B,Bicicleta De Montaña Rodada 29 Frenos Shimano 21V Aluminio,bla,gris,Deportes,461880,252
DNG-ROBLE1-BEI,Juego De Comedor Mesa Con 4 Sillas Roble,bla,gris,Muebles,455810,225
DNG-ROBLE1-MAR,Juego De Comedor Mesa Con 4 Sillas Roble,bla,gris,Muebles,455810,542
CENEX45,Caminadorra Electrica Nex 4.5 HP,bla,gris,Deportes,454965,128
VOLTFRI50,Frigobar 50 Litros 127V Puerta Reversible Voltio,bla,gris,Electrodomésticos,449850,132
KHMESAX4SMN,Sillas De Comedor y Mesa Metal Cocina Cafeteria Restaurante,bla,gris,Muebles,447840,82
EBIKE500-GN,Bicicleta Eléctrica con canastilla delantera batería 500W,bla,gris,Deportes,443960,39
EBIKE500-VN,Bicicleta Eléctrica con canastilla delantera batería 500W,bla,gris,Deportes,443960,50
DUOSPRING,Colchon 30cm resortes pocket coil Matrimonial Spring Series ColorDreams,bla,gris,Colchones,439920,134
SOLOSPRING20,Colchon 20cm resortes pocket coil Individual Spring Series ColorDreams,bla,gris,Colchones,434850,644
KMPR12T,Prensa hidraulica 12 toneladas KINGSMAN,bla,gris,Ferretería,433330,103
CENUVA5,Caminadora Electrica Monitor Nuva 2 HP,bla,gris,Deportes,422910,620
SPRINGDUO16,Colchon 16cm resortes MATRIMONIAL ColorDreams,bla,gris,Colchones,419800,433
KINGSPRING20,Colchon 20cm resortes pocket coil King Spring Series ColorDreams,bla,gris,Colchones,412425,162
300143,Rack Mueble Multiusos Cajon Repisas Microondas Cocina Hogar,bla,gris,Muebles,409907,200
KINGSDSBRO5N1,Desbrozadora Gasolina 5 en 1 Accesorios 52cc 2.5HP Motor 2T,bla,gris,Jardín,402870,12
DNG-SALVIA1-BEM,Juego De Comedor Mesa Con 4 Sillas Con Respaldo Salvia,bla,gris,Muebles,401390,425
BEDCOU1-MAD,Cama Matrimonial Con Cajones,bla,gris,Muebles,399960,82
BIFIPRO-18,Bicicleta Fija Spinning Pro 18 kg,bla,gris,Deportes,399960,0
XTRAIL-1G,Bicicleta De Montaña R26 Freno Disco Shimano 21 Velocidades,bla,gris,Deportes,399875,58
FWL26,Ventilador De Pared Industrial 26 Pulgadas Aluminio Kingsman,bla,gris,Electrodomésticos,359820,85
CP3DREAM120,Colchon plegable en 3 partes 120cm COLORDREAMS,bla,gris,Colchones,356790,364
SOFARE-GRI,Sofa Sillon Reclinable,bla,gris,Muebles,350910,138
DNG-MINE4-GRI,Juego De Comedor Mesa Con 4 Sillas Piedra Sintetica Mineral Caja 3,bla,gris,Muebles,349930,110
DNG-MINE4-BEI,Juego De Comedor Mesa Con 4 Sillas Piedra Sintetica Mineral Caja 3,bla,gris,Muebles,349930,78
KHCESP12IB,Colchoneta Colchón Individual Caja 8cm Memory Foam Espuma,bla,gris,Colchones,349750,84
ETRAIL-9B,Bicicleta Electrica Con Batería De 350W ETRAIL R27.5 Neon,bla,gris,Deportes,347970,109
RUMB30,"Set de 3 Maletas Rígidas ABS Rumbo 20/24""/28"" Azul Real""",bla,gris,Equipaje y bolsas,341820,90
RUMOR30,Set de 3 Maletas Rigídas ABS Rumbo,bla,gris,Equipaje y bolsas,341820,90
KHSOFASERENDG,NULL,bla,gris,Muebles,335940,0
40137-SZ,Mueble Zapatero Zapatera Organizador Madera 18 Pares Hogar,bla,gris,Muebles,332310,352
ETRAIL-8G,Bicicleta Electrica Con Batería De 250W ETRAIL R27.5 Neon,bla,gris,Deportes,329970,16
GAS-GEN3000,Generador A Gasolina Inverter 3000W Open Frame,bla,gris,Ferretería,323940,84
KHMESAX4S,Comedor de 4 Sillas Mesa Madera Cocina Restaurante Cafeteria,bla,gris,Muebles,323865,437
SOLOSPRING,Colchon 30cm resortes pocket coil Individual Spring Series ColorDreams,bla,gris,Colchones,314925,181
XTRAIL-2OR,Bicicleta De Montaña Rodada 29 Frenos Shimano 21V Aluminio,bla,gris,Deportes,307920,89
BAMBYFLEX360,Autoasiento 360 Para Carro Con Sistema Seguridad Coche Bebes,bla,gris,Bebés,307890,0
QUEENSPRING20,Colchon 20cm resortes pocket coil Queen Spring Series ColorDreams,bla,gris,Colchones,304430,127
KING1000,Generador Portatil A Gasolina 110v 2.9Hp Corriente Electrica,bla,gris,Ferretería,299900,108
VINTA-L,Bicicleta Urbana Con Canastilla VINTA R26 Neon,bla,gris,Deportes,288645,158
KHSOFABEDPLM,Sofa Cama Doble Sillon Plegable Matrimonial Colchon,bla,gris,Muebles,287880,155
RUMGR30,Set de 3 Maletas Rigídas ABS Rumbo,bla,gris,Equipaje y bolsas,284850,147
QUEENSPRING,Colchon 30cm resortes pocket coil Queen Spring Series ColorDreams,bla,gris,Colchones,283450,47
LIV-SILVER4-GRI,Sala para exterior silver,bla,gris,Muebles,279920,137
ETRAIL-8L,Bicicleta Electrica Con Batería De 250W ETRAIL R27.5 Neon,bla,gris,Deportes,274975,66
ETRAIL-8O,Bicicleta Electrica Con Batería De 250W ETRAIL R27.5 Neon,bla,gris,Deportes,274975,61
VINTA-R,Bicicleta Urbana Con Canastilla VINTA R26 Neon,bla,gris,Deportes,274900,140
KINGFCLNLB,VENTILADOR DE TECHO 56 PULGADAS CON LUZ Kingsman,bla,gris,Electrodomésticos,272610,100
DRESMULTI6-BLA,Mueble Armario Ropero Closet Multiusos 6 Puertas Mdp Caja 1,bla,gris,Muebles,267735,231
DRESMULTI6-CAF,Mueble Armario Ropero Closet Multiusos 6 Puertas Mdp Caja 1,bla,gris,Muebles,267735,49
DRESMULTI3-CAF,Mueble Armario Ropero Closet Multiusos 3 Puertas Mdp,bla,gris,Muebles,260010,218
KH4PLMC,Sala rattan para exterior con almohadones cushion 4pz (2cajas),bla,gris,Muebles,259980,76
XTRAIL-4B,Bicicleta De Montaña Doble Suspensión Rodada 29 Aluminio,bla,gris,Deportes,259950,70
LIV-SUMMER4-NEG,Sala para exterior con almohadones summer,bla,gris,Muebles,249950,54
SOFAMIA-GRO,Sofa Cama Mia 2 Cuerpos,bla,gris,Muebles,249900,295
DNG-GLAZI6-MAR,Juego De Comedor Mesa Con 6 Sillas Glazia Caja 1,bla,gris,Muebles,247960,18
KINGDSET6,Juego De Jardin 6 Piezas Sillas Exterior Mesa Con Sombrilla,bla,gris,Jardín,246935,245
KINGSPODA18,Podadora De Cesped A Gasolina 5HP 139CC Corte 18 Pulgadas 5 Posiciones Kingsman,bla,gris,Jardín,245940,8
BEDRM3-BLA,Juego de dormitorio ropero comoda y buro,bla,gris,Muebles,244930,249
BEDRM3-CHO,Juego de dormitorio ropero comoda y buro,bla,gris,Muebles,244930,98
XTRAIL-1BL,Bicicleta De Montaña R26 Freno Disco Shimano 21 Velocidades,bla,gris,Deportes,239925,45
TOPPER4K,Colchoneta Topper Cubrecolchon King Size 5cm,bla,gris,Colchones,239800,367
KINGCEP4,Caminadora Electrica Plegable KingSports,bla,gris,Deportes,234229,0
GAS-GEN2000,Generador A Gasolina Inverter 2000W Closed Frame,bla,gris,Ferretería,230970,46
HIDRO-GAS3200,Hidrolavadora A Gasolina 7HP 3200 PSI,bla,gris,Ferretería,227465,210
SOB-GALA2-GRI,Sofa cama gala 2 piezas,bla,gris,Muebles,224955,21
KHMESAX4SNE,Comedor de 4 Sillas Mesa Madera Cocina Restaurante Cafeteria,bla,gris,Muebles,224900,61
TOPPER1I,Colchoneta Topper Cubrecolchon Individual Memory Foam 5cm,bla,gris,Colchones,224700,666
KHSOFASERENG,Sofá Cama Reclinable Silla Convertible Sillón Sala Moderna,bla,gris,Muebles,223960,0
300050,Patin Traspaleta Hidraulico Capacidad 3 T Rueda Poliuretano,bla,gris,Ferretería,219960,102
DNG-SALVIA1-BEG,Juego De Comedor Mesa Con 4 Sillas Con Respaldo Salvia,bla,gris,Muebles,218940,0
KH3PLNC,Sala rattan para exterior con almohadones cushion 3pz,bla,gris,Muebles,217475,33
KH4PLN,Sala Exterior Para Jardín Textil 4 Pzas,bla,gris,Muebles,217195,317
GAS-GEN3500,Generador A Gasolina Inverter 3500W Closed Frame,bla,gris,Ferretería,213980,29
28117EH-INTEX,Alberca Piscina Inflable Easy Set 305 X 61 Cm + Bomba Intex,bla,gris,Jardín,213655,189
KHSOFABEDPLI,Sofa Cama Doble Sillon Plegable Individual Colchon,bla,gris,Muebles,212635,99
DPBI00030000,Bote Yate 6 Personas De Lujo Con 2 Hieleras Inflable Playa,bla,gris,Jardín,209970,67
FLR24,Ventilador De Piso Industrial 24 Pulgadas Aluminio Kingsman,bla,gris,Electrodomésticos,208165,137
XTRAIL-1W,Bicicleta De Montaña R26 Freno Disco Shimano 21 Velocidades,bla,gris,Deportes,207935,48
XTRAIL-3G,Bicicleta De Montaña R26 Freno Disco Shimano 21 Vel Aluminio,bla,gris,Deportes,207845,176
VINTA-M,Bicicleta Urbana Con Canastilla VINTA R26 Neon,bla,gris,Deportes,206175,249
KMPR20T,Prensa Hidráulica 20 Ton Gato Hidráulico Acero Industrial,bla,gris,Ferretería,204950,134
SPRINGSINGLE16,Colchon 16cm resortes INDIVIDUAL ColorDreams,bla,gris,Colchones,203880,120
TWR32,Ventilador de torre 34 pulgadas con control remoto Voltio,bla,gris,Electrodomésticos,201320,766
LIV-SUNSET4-BEI,Sala para exterior con almohadones sunsent,bla,gris,Muebles,199980,18
LIV-SUNSET4-VER,Sala para exterior con almohadones sunsent,bla,gris,Muebles,199980,14
SOFA-REVE3P-BEI,Sofa sala esquinera reversible izquierda o derecha 3 plazas,bla,gris,Muebles,199975,156
SOFA-REVE3P-GRI,Sofa sala esquinera reversible izquierda o derecha 3 plazas,bla,gris,Muebles,199975,131
SOFALUXE-BEI,Sofa Sillon Reclinable Luxe Caja 1,bla,gris,Muebles,199960,0
COMBO-COLEMAN-04,NULL,bla,gris,Jardín,199900,95
DNG-LIZO4-GRI,Juego De Comedor Mesa Con 4 Sillas Lizo Caja 1,bla,gris,Muebles,193470,62
KMBCF38G,Caja Fuerte Biometrica Grande Digital Huella De Seguridad,bla,gris,Otros,191880,49
DNG-SUNSET5-BEI,Juego De Comedor Mesa Con 5 Sillas Sunset,bla,gris,Muebles,189980,21
DNG-SUNSET5-VER,Juego De Comedor Mesa Con 5 Sillas Sunset,bla,gris,Muebles,189980,42
300588,Escritorio Con Repisas y Cajones Para Computadora Estudiante,bla,gris,Muebles,188865,663
67472-BEST,Colchón Inflable Matrimonial Con Bomba Aire Pavillo Bestway,bla,gris,Jardín,187250,147
VOLTFRI90,Frigobar 90 Litros VOLTFRI90 Voltio,bla,gris,Electrodomésticos,182707,22
DNG-LUMI4-BLA,NULL,bla,gris,Muebles,179955,0
DNG-LUMI4-NEG,NULL,bla,gris,Muebles,179955,0
KHSOFABED2GO,Sofa Cama Contemporaneo KingsHouse,bla,gris,Muebles,173789,0
XTRAIL-2G,Bicicleta De Montaña Rodada 29 Frenos Shimano 21V Aluminio,bla,gris,Deportes,173205,50
H1PSVOLTI,Refrigerador 1.6 Pies/47 Litros Con Congelador 1 Puerta 115V,bla,gris,Electrodomésticos,171675,341
DRESMULTI2-BLA,Mueble Armario Ropero Closet Multiusos 2 Puertas Mdp,bla,gris,Muebles,169915,426
FVT26,Ventilador Pedestal Industrial 26 Pulgadas De Pie Kingsman,bla,gris,Electrodomésticos,169915,80
KHSRO24,Silla De Ruedas Ligera Plegable Traslado Compacta Con Freno,bla,gris,Salud,169900,0
TOPDREAM4K,Colchoneta Cubre Colchon Topper 5cm King Size,bla,gris,Colchones,169900,11
KHSOFASERENB,NULL,bla,gris,Muebles,167970,0
KHLOUNGERLG-KIT2,NULL,bla,gris,Jardín,166455,0
EBIKE800-G,Bicicleta Moto Eléctrica con caja trasera batería 800W,bla,gris,Deportes,164990,101
KINGPUMP65,Motobomba a Gasolina Uso Agricola Autocebante Motor 6.5hp 6L,bla,gris,Ferretería,161910,100
KINGSHOGA52,Motoperforadora Ahoyadora A Gasolina Motor 2 Tiempos 52CC 2.5HP Con 3 Barrenas Broca de tierra Kingsman,bla,gris,Jardín,159445,2
JAR-MASON8-BAM,Dispensador de bebidas tipo mason jar con base 8 litros,bla,gris,Cocina,156584,17
HIDROKING1500,Hidrolavadora Electrica Portatil 1500 Psi 1400w + Accesorios,bla,gris,Ferretería,155870,85
67404-BEST,Colchon Inflable Queen Tritech Con Bomba Aire 203cm Bestway,bla,gris,Jardín,154297,41
KHLOUNGERDG,CAMASTRO ESTRUCTURA METALICA Y ASIENTO DE TEXTILENO,bla,gris,Jardín,152915,124
HIDRO-GAS2600,Hidrolavadora A Gasolina 6.5HP 2600 PSI,bla,gris,Ferretería,152475,50
KH4PLM,Sala Exterior Para Jardín Textil 4 Pzas,bla,gris,Muebles,150062,151
300201-SZ,Mueble Cajonero Comoda Organiador Ropa 8 Cajones 90cm Blanco,bla,gris,Muebles,149950,96
VWINE12,Cava De Vinos Para 12 Botellas VWINE12 VOLTIO,bla,gris,Electrodomésticos,149950,120
DRESMULTI2-CHO,Mueble Armario Ropero Closet Multiusos 2 Puertas Mdp,bla,gris,Muebles,149925,138
DRESMULTI2-CAF,Mueble Armario Ropero Closet Multiusos 2 Puertas Mdp,bla,gris,Muebles,149925,185
TOPPER3Q,Colchoneta Topper Cubrecolchon Queen Size 5cm,bla,gris,Colchones,149850,44
300192-SZ,Mueble Armario Closet Multiuso 2 Puertas + Estantes Mdp Casa,bla,gris,Muebles,149435,23
LIV-SUNSET5-BEI,Sala para exterior con almohadones sunsent,bla,gris,Muebles,148485,16
LIV-SUNSET5-VER,Sala para exterior con almohadones sunsent,bla,gris,Muebles,148485,16
100005-SZ,Rack Mueble Con Repisas Multiusos Horno De Microondas Cocina,bla,gris,Muebles,148365,164
KINGSINGLE3,Base Cama Individual Abatible Blanca KingsHouse Desmontable,bla,gris,Muebles,147960,50
67226-BEST,Colchón Inflable Queen con Bomba de Pie Integrada Bestway,bla,gris,Jardín,146970,191
H1PLVOLTI,Refrigerador 4 Pies/121 Litros Con Congelador 1 Puerta 115V,bla,gris,Electrodomésticos,143960,82
TWR291,Ventilador de torre 29 pulgadas con control remoto Voltio,bla,gris,Electrodomésticos,143760,438
LIV-TERRA4-MAR,Sala para exterior terra,bla,gris,Muebles,142475,44
KHLOUNGERLG,CAMASTRO ESTRUCTURA METALICA Y ASIENTO DE TEXTILENO,bla,gris,Jardín,142425,371
KHGABH4,NULL,bla,gris,Muebles,141960,21
67631-BEST,Colchón Inflable Queen Con Bomba Aire Para Acampar Bestway,bla,gris,Jardín,141310,262
HJFPBN000000,Batidora Mezcladora de pedestal (FOOD PROCESSOR),bla,gris,Electrodomésticos,141217,77
DNG-ROBLE2-BEI,Juego De Comedor Mesa Con 4 Sillas Roble,bla,gris,Muebles,140195,26
URBAN-B,Bicicleta Plegable Vintage R20 7 Velocidades Aluminio Neon,bla,gris,Deportes,139950,80
URBAN-G,Bicicleta Plegable Vintage R20 7 Velocidades Aluminio Neon,bla,gris,Deportes,139950,85
CLOUDUO15,Colchon 15cm de espuma MATRIMONIAL ColorDreams,bla,gris,Colchones,139930,88
SBCLOUD2B,Sofa cama sillon colchon plegable Matrimonial ColorDreams,bla,gris,Colchones,138215,34
VINTA-B,Bicicleta Urbana Con Canastilla VINTA R26 Neon,bla,gris,Deportes,137450,80
KHMESAX4SMC,Sillas De Comedor y Mesa Metal Cocina Cafeteria Restaurante,bla,gris,Muebles,131553,46
KHSOFALEIADG,Sofá Cama Silla Sillón Plegable Sala Moderna Velvet + Cojín,bla,gris,Muebles,129980,15
KHSOFALEIAG,NULL,bla,gris,Muebles,129980,0
KHLOUNGERDG-KIT2,NULL,bla,gris,Jardín,129465,0
300298,Mesa Plegable Portatil 180cm Portafolio Tipo Rattan Plastico,bla,gris,Muebles,129064,29
KHMIRRE,Espejo Led Baño Luz Led W100xH65 Rectangular,bla,gris,Muebles,125930,207
SOFA-SERENE-GRO,Sofa Cama 3 Cuerpos Serene,bla,gris,Muebles,124975,89
KINGBISTRO3DG,JUEGO DE 3 PIEZAS PARA JARDIN MESA + SILLAS,bla,gris,Jardín,123675,234
FLR24Y,Ventilador De Piso Industrial 24 Pulgadas Aluminio Amarillo Kingsman,bla,gris,Electrodomésticos,120945,1
KH4PLBC,Sala para exterior acero con almohadones cushion 4pz (2cajas),bla,gris,Muebles,119980,149
BEDSIN1-BLA,Cama Individual Abatible,bla,gris,Muebles,119970,38
SGXMASL210S,ARBOL PINO DE NAVIDAD DECORATIVO NEVADO PREILUMINADO 210 CM,bla,gris,Hogar,119960,108
HIDROKING2000RM,Hidrolavadora Eléctrica Portatil 2000 Psi Cepillo Accesorios,bla,gris,Ferretería,119925,16
300142,Escritorio Con Repisas y Cajones Para Computadora Estudiante,bla,gris,Muebles,118915,163
KINGBIFI18,Bicicleta Fija 18 kg Estática Para Spinning Cardio Fitness,bla,gris,Deportes,116970,2
KINGBIFI8,Bicicleta Fija 8 Kg Spinning Cardio Fitness Kingsports,bla,gris,Deportes,114954,69
TOPDREAM2M,Colchoneta Cubre Colchon Topper 5cm Matrimonial,bla,gris,Colchones,114900,71
XTRAIL-3B,Bicicleta De Montaña R26 Freno Disco Shimano 21 Vel Aluminio,bla,gris,Deportes,113370,125
XTRAIL-1O,Bicicleta De Montaña R26 Freno Disco Shimano 21 Velocidades,bla,gris,Deportes,111965,0
28131-INTEX,Piscina Alberca Redonda Inflable Easy Set 3.6m X 76cm Intex,bla,gris,Jardín,111960,152
KHMESHB,Silla de Escritorio Ergonomica Negra Tapizado Mesh Oficina,bla,gris,Muebles,111840,130
TOLIXKIT#4-BA2NEM,NULL,bla,gris,Muebles,109960,0
DRESMULTI2-NOG,Mueble Armario Ropero Closet Multiusos 2 Puertas Mdp,bla,gris,Muebles,109945,79
CHEST-L5H-BEI,Mesa Comoda De Tela Con 5 Cajones Horizontal,bla,gris,Muebles,109900,210
CHEST-L5H-GRI,Mesa Comoda De Tela Con 5 Cajones Horizontal,bla,gris,Muebles,109900,321
SWG-SUMMER-GRI,Columpio para exterior summer,bla,gris,Muebles,107960,12
KINGSCOFFETABLE1,Mesa De Centro Elevable De Madera Con Compartimento Oculto,bla,gris,Muebles,106140,179
KINGSCOFFETABLE2,Mesa De Centro Elevable De Madera Con Compartimento Oculto,bla,gris,Muebles,106140,103
KINGSDESBROP,Desbrozadora Gasolina 52cc 2.5 HP Podadora Con Accesorios,bla,gris,Jardín,101940,42
SOFA-SERENE-BEI,Sofa Cama 3 Cuerpos Serene,bla,gris,Muebles,99980,148
SOFA-SERENE-GRI,Sofa Cama 3 Cuerpos Serene,bla,gris,Muebles,99980,39
VOEPPRO4,Escalera Plegable Aluminio 4 Escalones Fold A Step Portátil,bla,gris,Escaleras,99950,197
BATH-MI60-MAD,Botiquín Con Espejo Para Baño 60 cm,bla,gris,Muebles,98940,75
KINGDSET6G,Juego De Jardin 6 Piezas Sillas Exterior Mesa Con Sombrilla,bla,gris,Jardín,98774,38
BAMBYFLEX,Autoasiento Para Carro Silla de Bebe Seguridad 9m A 11 Años,bla,gris,Bebés,98724,108
BAMBYFLEX360G,Autoasiento 360 Para Carro Con Sistema Seguridad Coche Bebes,bla,gris,Bebés,97965,1
URBAN-O,Bicicleta Plegable Vintage R20 7 Velocidades Aluminio Neon,bla,gris,Deportes,97965,70
DNG-LIZO4-GRO,Juego De Comedor Mesa Con 4 Sillas Lizo Caja 1,bla,gris,Muebles,96735,17
COLORINOX7M,Bateria De Cocina 7 Pzas Acero Inoxidable Tricapa Colorhome,bla,gris,Cocina,94900,0
XTRAIL-3L,Bicicleta De Montaña R26 Freno Disco Shimano 21 Vel Aluminio,bla,gris,Deportes,94475,22
JAR-MASON5-MET,Dispensador de bebidas tipo mason jar con base 5 litros,bla,gris,Cocina,93765,500
XTRAIL-4G,Bicicleta De Montaña Doble Suspensión Rodada 29 Aluminio,bla,gris,Deportes,93582,18
DNG-GLAZI6-GRI,Juego De Comedor Mesa Con 6 Sillas Glazia Caja 1,bla,gris,Muebles,92985,25
57275-BEST,Alberca Fast Set Semi Inflable 366cm Circular Bomba Bestway,bla,gris,Jardín,91960,85
VNT-PROSIL-WTH-MUS,NULL,bla,gris,Hogar,91350,337
CHEST-L5V-GRI,Mesa Comoda De Tela Con 5 Cajones Vertical,bla,gris,Muebles,89910,34
CHEST-L5V-BEI,Mesa Comoda De Tela Con 5 Cajones Vertical,bla,gris,Muebles,89910,201
BAMBYMOON30,Colchón Cuna - 70x130x10cm MEDIUM BAMBYMOON30 BAMBY,bla,gris,Colchones,88110,183
TWR29,Ventilador de torre 29 pulgadas silencioso giratorio Voltio,bla,gris,Electrodomésticos,88020,282
KMUTC3,Carro de servicio de 3 niveles KINGSMAN,bla,gris,Otros,87890,1
2160832,Hielera Coleman Con Ruedas Portavasos 60qt 56l Para 94 Latas,bla,gris,Jardín,87169,9
BAMBYDREAM40,Colchón Cuna - 80x140x15cm LARGE BAMBYDREAM40 BAMBY,bla,gris,Colchones,86940,154
KTM0018-KLE,KIT Pinza Electricista Con Probador De Voltaje Sin Contacto,bla,gris,Ferretería,84370,158
BATH-MI60-BLA,Botiquín Con Espejo Para Baño 60 cm,bla,gris,Muebles,82450,124
300244-SZ,Mesa Escritorio Gamer Mueble Juvenil De Computadora Moderno,bla,gris,Muebles,80548,138
BAMBYDREAM20,Colchón de Cuna - 60x120x15cm SMALL BAMBYDREAM20 BAMBY,bla,gris,Colchones,79920,134
28107EH-INTEX,Alberca Piscina Inflable Circular 2.44 M Easy + Bomba Intex,bla,gris,Jardín,79762,84
CHEST-M4-BEI,Mesa Comoda De Tela Con 4 Cajones,bla,gris,Muebles,78900,243
CHEST-M4-GRI,Mesa Comoda De Tela Con 4 Cajones,bla,gris,Muebles,78900,114
COLORCONT5G,Juego de Contenedores Hermeticos Recipiente de Vidrio 5pzas,bla,gris,Cocina,78575,55
BAMBYFLEXG,Autoasiento Para Carro Silla de Bebe Seguridad 9m A 11 Años,bla,gris,Bebés,77940,78
KINGFCLNB,VENTILADOR DE TECHO 56 PULGADAS Kingsman,bla,gris,Electrodomésticos,77870,1111
BAMBYBASIC,Colchón Cuna – 70x100x7cm STANDAR BAMBYBASIC BAMBY,bla,gris,Colchones,77503,15
KMMC36,"Cama para mecanico 36 KINGSMAN""",bla,gris,Otros,76860,200
BAMBYDREAM40X,Colchón Cuna - 95x140x15cm EXTRA LARGE BAMBYDREAM40X BAMBY,bla,gris,Colchones,76455,105
KINGSPLT25,Patín Hidráulico Transpaleta De 2 Ton Acero Uso Rudo Tarima,bla,gris,NULL,75981,17
HSO-8013-SYN,Pack Soplador Electrico 1100W E Hidrolavadora 1200W,bla,gris,Ferretería,75960,95
2094860-CON,Termo Acero Inox Sistema Snapseal Byron 710 Ml Contigo,bla,gris,Jardín,75810,58
COLORINOX11C,Bateria De Cocina 11Pzas Acero Inoxidable Tricapa Colorhome,bla,gris,Cocina,74950,4
KINGBISTRO3LG,JUEGO DE 3 PIEZAS PARA JARDIN MESA + SILLAS,bla,gris,Jardín,74205,80
COLORINOX11G,Bateria De Cocina 11Pzas Acero Inoxidable Tricapa Induccion,bla,gris,Cocina,71955,14
BAMBYGO,Colchón Cuna De Viaje - 68x95x6cm TRIP BAMBYGO BAMBY,bla,gris,Colchones,71900,92
KINGDIPLE120,Diablito de Carga Extensible Carrito Plegable 100kg Kingsman,bla,gris,Ferretería,71880,190
FLR30Y,Ventilador De Piso Industrial 30 Pulgadas Aluminio Amarillo Kingsman,bla,gris,Electrodomésticos,71372,7
KINGSRACK4,Rack Multiusos para Cocina 4 Repisas para Horno de Microondas y Garrafón con Extensión de Repisa LFN,bla,gris,Muebles,70929,45
67224-BEST,Colchon Inflable Individual Bomba Aire de Pie 67224 Bestway,bla,gris,Jardín,70020,365
100007-SZ,Escritorio De Computadora Repisas Cajones Estudiantil Hogar,bla,gris,Muebles,69960,228
CLOUDSINGLE15,Colchon 15cm de espuma INDIVIDUAL ColorDreams,bla,gris,Colchones,69705,43
KMBCF35G,Caja fuerte Biometrica Mediana Digital Huella De Seguridad,bla,gris,Otros,68940,84
