sku,sku_name,brand,buyer,category,objetivo_mensual_gmv,stock_actual
H1PSVOLTB,Refrigerador 1.6 Pies/47 Litros Con Congelador 1 Puerta 115V,bla,gris,Electrodomésticos,68670,31
KMCF23N,Caja Fuerte Negra De Seguridad Digital Con Llave Pequeña,bla,gris,NULL,67350,131
53068-BEST,Centro Juego Acuatico Alberca Inflable Play Center Bestway,bla,gris,Jardín,66760,81
SOB-VEGA3-GRI,Sofa cama vega,bla,gris,Muebles,65978,5
HIDROKING1300,Hidrolavadora Electrica Portatil 1300 Psi 1200w + Accesorios,bla,gris,Ferretería,65940,30
KINGCHEST5,Comoda Cajonera de 5 Cajones Mueble Organizador Tela Madera,bla,gris,Muebles,65940,66
KINGBUNK4,Litera Doble Individual Base Cama KingsHouse Desmontable,bla,gris,Muebles,65235,9
BAMBYFLEXR,Autoasiento Para Carro Silla de Bebe Seguridad 9m A 11 Años,bla,gris,Bebés,64950,127
VNT-PROSIL-BLK-MUS,NULL,bla,gris,Hogar,64893,96
300197-SZ,Mueble Mesa Rack Modular Television 7 Repisas Ruedas 180 Cm,bla,gris,Muebles,64715,125
TOLIXKIT#4-CLA2NEM,NULL,bla,gris,Muebles,63980,0
VOEPPRO5,Escalera Plegable Aluminio 5 Escalones Fold A Step Portátil,bla,gris,Escaleras,62970,88
57183NP-INTEX,Alberca Piscina Familiar Canasta De Basketball Hogar Intex,bla,gris,Jardín,62955,73
COLORINOX12,Bateria De Cocina 12 Piezas Acero Inox Triple Capa Induccion,bla,gris,Cocina,62955,2
BATH-MI60-LED,Espejo Para Baño Luz Lez Redondo 60 cm,bla,gris,Muebles,62940,261
KMET50,Escalera Telescopica Retractil Aluminio 13 Escalones 5 m RY-1350 Kingsman,bla,gris,Ferretería,61215,25
BATH-MI75-MAD,Botiquín Con Espejo Para Baño 75 cm,bla,gris,Muebles,61215,117
2160823,Hielera Coleman Portatil Con Asa 9qt 8 Litros Para 10 Latas,bla,gris,Jardín,61098,48
28040-INTEX,Cobertor Cubierta Alberca Circular Delux Ultra 4.88m Intex,bla,gris,Jardín,59970,60
2094865-CON,Termo 20oz 591 Ml Tipo Taza Acero Inox Frio Caliente Contigo,bla,gris,Jardín,59850,282
28022-INTEX,Cubierta Cobertor Tapa Para Alberca Redonda Azul 360cm Intex,bla,gris,Jardín,59220,673
KINGPRESSB,Banco Para Pesas Plegable Inclinado Entrenamiento Fitnness,bla,gris,Deportes,58455,184
SFDHERGBN350A-BEL,Pistola Impacto Disparador Fijacion 8mm 3in Gb-350a Gram-bel,bla,gris,Ferretería,57980,11
KMCF23NR,Caja Fuerte Digital Kingsman Negro Alcancia Metal 17x23x17,bla,gris,Otros,57472,80
300485,Polipasto Manual Garrucha Carga 2 Toneladas Cadena 5 Metros,bla,gris,Ferretería,57450,159
KINGBIFI1,Bicicleta Fija Para Spinning Cardio Fitness Kingsports,bla,gris,Deportes,56994,11
HJCWWB010000,Closet Ropero Armable Armario 2 A 4ft Ajustable Reforzado,bla,gris,Hogar,56940,251
JAR-MASON8-2,Dispensador de bebidas tipo mason jar con base 8 litros 2 piezas,bla,gris,Cocina,56074,26
2094861-CON,Termo Acero Inox Sistema Snapseal Byron 710 Ml Contigo,bla,gris,Jardín,55860,202
CONT-HERMET5,Juego de contenedores hermeticos 5 piezas,bla,gris,Cocina,55350,223
TOLIXKIT#4-BA2BLA,NULL,bla,gris,Muebles,54980,0
KINGCHEST5GN,Comoda Cajonera de 5 Cajones Mueble Organizador Tela Madera,bla,gris,Muebles,54950,46
KINGFCLNBKIT3,NULL,bla,gris,Electrodomésticos,53955,20
TOLIXKIT#4-CLA1ROJ,NULL,bla,gris,Muebles,52980,0
SOFA-LEIA-GRI,Sofa Cama 3 Cuerpos Con Almohadones 5 Piezas Leia,bla,gris,Muebles,52792,31
SOFA-LEIA-VER,Sofa Cama 3 Cuerpos Con Almohadones 5 Piezas Leia,bla,gris,Muebles,52792,15
KHMIRRE2,Espejo Con Luz Led Rectangular De 120x65 cm Touch Baño Pared,bla,gris,Muebles,52470,79
KINGCHEST5-1G,Comoda Cajonera 5 Cajones Mueble Organizador de Tela Madera,bla,gris,Muebles,52450,117
TOLIXKIT#4-BA2ROJ,NULL,bla,gris,Muebles,51980,0
TOLIXKIT#4-CLA1BLA,NULL,bla,gris,Muebles,51980,0
KINGPRESSM6,Ejercitador Aparato Banco Multifuncional Abdomen Brazos 6en1,bla,gris,Deportes,51705,221
DPBMBP000001,Banco Multiposiciones con polea para Gym,bla,gris,Deportes,50980,120
2180606,Hielera Flexible Lonchera PRO SOFT COOLER 16 Latas Coleman,bla,gris,Deportes,50970,39
TOPDREAM1I,Colchoneta Cubre Colchon Topper Memory Foam 5cm Individual,bla,gris,Colchones,49950,96
SKYROUNDST36B,BANCO GIRATORIO 360 REDONDO,bla,gris,Hogar,48965,87
SKYROUNDST36W,BANCO GIRATORIO 360 REDONDO,bla,gris,Hogar,48965,134
706632-PEL,Escalera 1 Escalon Mini Linea Casa Azul Peldaños,bla,gris,Ferretería,48951,47
HJBOEL000000,Inflador Eléctrico,bla,gris,Jardín,48860,267
KMMC40,"Cama para mecanico 40 KINGSMAN""",bla,gris,Otros,48675,24
06019G80G1-BOS,Atornillador Taladro Inalámbrico Batería 12V Bosch GSR120-Li,bla,gris,Ferretería,47970,43
GB-100S-BEL,Herramienta de Fijación 8 mm GB-100S Gram-Bel,bla,gris,Ferretería,47970,1
2204456-CON,Termo Para Agua 40oz 1.18Lt Acero Inox Streeterville Contigo,bla,gris,Hogar,47610,337
VWINE8,Cava De Vinos Para 8 Botellas VWINE8 VOLTIO,bla,gris,Electrodomésticos,45581,16
2094853-CON,Termo Acero Inoxidable Sistema Snapseal Byron 591 Ml Contigo,bla,gris,Jardín,45370,49
KHSO113,Silla de Escritorio Ejecutiva Ergonomica Ajustable Negro,bla,gris,Muebles,44955,0
BAMBYNOOZ3,Corral Cuna Bebe Viaje Plegable,bla,gris,Bebés,44603,71
KINGSINGLE5,Base Cama Individual Con Cajones KingsHouse Recamara,bla,gris,NULL,44388,17
VINTA-N,Bicicleta Urbana Con Canastilla VINTA R26 Neon,bla,gris,Deportes,43984,5
BATH-MI75-BLA,Botiquín Con Espejo Para Baño 75 cm,bla,gris,Muebles,43725,102
DREAMSPEDIC,Almohada Ortopedica Memory Foam Estandar DREAMSPEDIC Colordreams,bla,gris,Colchones,43625,123
300322,Gabinete Rack Organizador Estante Repisas Microondas Cocina,bla,gris,Muebles,43470,29
B1275-SZ,Combo Escritorio + Estante 3 Niveles + Estante Casa Oficina,bla,gris,Muebles,43168,41
FVT30,Ventilador Pedestal Industrial 30 Pulgadas De Pie Kingsman,bla,gris,Electrodomésticos,42980,3
SBCLOUDB,Sofa cama sillon colchon plegable Individual ColorDreams,bla,gris,Colchones,41988,8
2194261-CON,Termo Acero Inox Sistema Snapseal Byron 710 Ml Contigo,bla,gris,Jardín,41895,0
300191-SZ,Mueble Armario Closet Multiuso 2 Puertas + Estantes Mdp Casa,bla,gris,Muebles,41382,0
KINGSVIBC6,Vibrador de Concreto A Gasolina 6.5 HP con Chicote 6 mts Kingsman,bla,gris,Ferretería,40792,4
JAR-MASON4,Dispensador de bebidas tipo mason jar 4 litros,bla,gris,Cocina,40089,365
KINGSINGLE4,Base Cama Individual Con Cajones KingsHouse Recamara,bla,gris,NULL,39990,19
TOLIXKIT#2-CLA2NEM,NULL,bla,gris,Muebles,39980,0
KINGCHEST2W,Comoda Cajonera de 2 Cajones Mesita de Noche Estante Abierto,bla,gris,Muebles,39950,132
HJPEPM280002,Persiana Horizontal Enrollable Pvc 160x120 Ajustable Moderna,bla,gris,Hogar,39900,78
2158120,Hielera Flexible con Ruedas y Asa 42 latas Azul Coleman,bla,gris,Deportes,38970,78
B1276-SZ,Escritorio + Estante De 3 Niveles + Estante 1 Nivel Para Estudiante,bla,gris,Muebles,38970,26
2204453-CON,Termo Para Agua 40oz 1.18Lt Acero Inox Streeterville Contigo,bla,gris,Hogar,37030,322
2198356-CON,Termo Botella De Agua 32 Oz Acero Inox Autopop Contigo,bla,gris,Hogar,36985,156
2199282-CON,Termo Botella De Agua 32 Oz Acero Inox Autopop Contigo,bla,gris,Hogar,36985,164
67004-BEST,Colchon Inflable Kingsize Bestway 67004 Para Campismo,bla,gris,Jardín,36783,70
URBAN-L,Bicicleta Plegable Vintage R20 7 Velocidades Aluminio Neon,bla,gris,Deportes,36387,9
BAMBYDREAM30,Colchón Cuna - 70x130x15cm MEDIUM BAMBYDREAM30 BAMBY,bla,gris,Colchones,35970,110
100006-SZ,Escritorio De Computadora Repisas Cajones Estudiantil Hogar,bla,gris,Muebles,34980,44
300193-SZ,Mueble Armario Closet Multiuso 2 Puertas + Estantes Mdp Casa,bla,gris,Muebles,34485,3
HJSBSB020001,Sombrilla Para Jardin Exterior Plegable 3mts Con Inclinacion,bla,gris,Jardín,34485,16
HJSBSB050001,Sombrilla Para Jardin Exterior Plegable 3mts Con Inclinacion,bla,gris,Jardín,34485,16
KINGMSK400,Careta Electrónica para Soldar Diseños Kingsman,bla,gris,NULL,34350,225
43402-BEST,Sillón Inflable Para Alberca Piscina Con Portavaso Bestway,bla,gris,Jardín,32970,61
KINGCHEST5W,Comoda Cajonera de 5 Cajones Mueble Organizador Tela Madera,bla,gris,Muebles,32970,41
KINGBIFI6,Bicicleta Fija Negra KINGBIFI6 KINGSPORTS,bla,gris,Deportes,32283,5
300257,Banco Alto Respaldo Tipo Tolix Vintage Minimalista Moderno,bla,gris,Muebles,31960,200
KHGMIRM,Espejo Led Baño Luz Led 50x60 rectangular,bla,gris,Muebles,31960,148
HJAN18050001,Arbol de Navidad 1.80m,bla,gris,Hogar,31960,93
SKYXMASTREE210,"Arbol de navidad 2,10",bla,gris,Hogar,31960,100
KINGPRESST,Estacion Dominadas Banco Ejercicio Musculacion Fitness Gym,bla,gris,Deportes,31788,31
2169466-CON,Termo Acero Inox Sistema Snapseal Byron 473 Ml Contigo,bla,gris,Jardín,31410,130
KMCF23G,Caja Fuerte Negra De Seguridad Digital Con Llave Pequeña,bla,gris,NULL,30981,67
TOLIXKIT#2-CLA2BLA,NULL,bla,gris,Muebles,29985,0
3000006476,Hielera Coleman 61lts Nevera Ruedas Camping Enfriador 65 Qt,bla,gris,Jardín,29980,16
2000037612,Hielera Flexible XPAND SOFT COOLER 30 Latas Coleman,bla,gris,Deportes,29970,88
SHWRCH1,Silla Baño Ducha Discapacitados Brazos Respaldo,bla,gris,Salud,29970,14
D-37029-MAK,Kit 5 Brocas Multiproposito Omnibohrer Para Taladro Makita,bla,gris,Ferretería,29700,654
MAGNEKING4KIT,Kit 4 Escuadras Magnetica 4 In 50 Lb 22 Kg Juego Para Soldar,bla,gris,Ferretería,29590,395
CHEST-M3-GRI,Mesa Comoda De Tela Con 3 Cajones,bla,gris,Muebles,29205,189
CHEST-M3-BEI,Mesa Comoda De Tela Con 3 Cajones,bla,gris,Muebles,29205,112
28026-INTEX,Cobertor Cubierta De Alberca Piscina Easy Set 3.96 M Intex,bla,gris,Jardín,28720,196
29056-INTEX,Kit Limpieza Hojas Alberca Piscina + Cepillo + Cabezal Intex,bla,gris,Jardín,28710,121
2147560,Mochila Hielera tipo Backpack 30 latas Gris Coleman,bla,gris,Deportes,28470,53
KHGABP4,Mueble Gabinete Para Baño Lavamanos Con Espejo Lavabo Ovalin,bla,gris,Muebles,28392,51
FLR30,Ventilador De Piso Industrial 30 Pulgadas Aluminio Kingsman,bla,gris,Electrodomésticos,28039,10
300640,Banco Alto Tolix Vintage Para Comedor Restaurante Exterior,bla,gris,Muebles,27960,0
43554-BEST,Flotador Para Alberca Inflable Almohada Removible Bestway,bla,gris,Jardín,26760,74
TOLIXKIT#4-CLA1NEM,NULL,bla,gris,Muebles,26490,0
2201794-CON,Termo Para Agua 40oz 1.18Lt Acero Inox Streeterville Contigo,bla,gris,Hogar,26450,217
3000006578,Hielera COOLER 52 QT Modelo 3000006578,bla,gris,Deportes,25980,36
KINGSALONSH10,Carrito Organizador Estética Multiusos De 10 Niveles Cajones,bla,gris,Belleza y Cuidado Personal,25980,46
COLORCONT4,Juego de Contenedores Canister Plástico Premium 4 Piezas COLORCONT4 ColorHome,bla,gris,Cocina,25870,227
BSHD02170001,Difusor Humidificador Usb,bla,gris,Salud,25060,20
KINGCHEST5W-1,Comoda Cajonera de 5 Cajones Tela Estructura Acero Madera,bla,gris,Muebles,24975,31
2158118,Hielera Flex Mochila CHILLER SOFT COOLER 28 Latas Coleman,bla,gris,Deportes,23970,85
BAMBYMOON20,Colchón Cuna - 60x120x10cm SMALL BAMBYMOON20 BAMBY,bla,gris,Colchones,23970,44
CEC3VOLT,Calefactor Calentador Halogeno Electrico De Cuarzo 3 Niveles,bla,gris,Electrodomésticos,23960,64
BAMBYBOOST,Asiento Elevador Coche Para Bebe Booster Carro Cojin Silla,bla,gris,Bebés,23920,151
2164919-CON,Termo 16 Oz Sistema Dual Acero Inox Frío Caliente Contigo,bla,gris,Hogar,23450,123
HJPEPB010000,Persiana Horizontal Enrollable Pvc 160x120 Ajustable Moderna,bla,gris,Hogar,22740,97
2164911-CON,Termo 18 Oz Sistema Dual Frío Caliente Acero Inox Contigo,bla,gris,Hogar,22455,112
57441NP-INTEX,Piscina Inflable De Unicornio Redonda Niños 2.72m Intex,bla,gris,Jardín,22455,64
300227,Soporte Taladro Vertical Con Base Hierro 0 A 60 Mm Ajustable,bla,gris,Ferretería,22450,369
KINGSALONAUXW1,Carrito Mesa Auxiliar Mueble Multiusos 1 Cajón Spa Estética,bla,gris,Belleza y Cuidado Personal,22380,43
DREAMSPEDICQ,Almohada Ortopedica Memory Foam Queen DREAMSPEDICQ Colordreams,bla,gris,Colchones,22140,65
KMCF38N,Caja Fuerte Digital Kingsman Color Negro 30x38x30 Seguridad,bla,gris,Otros,22083,20
SOB-GALA3-GRI,Sofa cama gala 3 piezas,bla,gris,Muebles,21996,23
3000006572,Hielera Coleman 49l Nevera 52qt Gris 80 Latas Portatil Asas,bla,gris,Jardín,21980,0
28048-INTEX,Tapete Protector De Piso Albercas Infables Y Metalicas Intex,bla,gris,Jardín,21160,91
DW1163-DWA,Juego Set Kit De Brocas 13 Piezas Black Oxide Dw1163 Dewalt,bla,gris,Ferretería,21160,80
2160841,Hielera Coleman Portatil 16qt 15lts Con Asa Para 22 Latas,bla,gris,Jardín,20970,3
66633E-INTEX,Bomba Electrica Para Inflable De Alberca 12 V A 110 V Intex,bla,gris,Jardín,20970,61
KMCF35NR,Caja Fuerte De Seguridad Digital Grande Con Ranura,bla,gris,Otros,20878,0
300150,Broca Carpintero Madera Avellanadora 7 Piezas 1/8 a 3/8in,bla,gris,Ferretería,20640,902
HJSR2A000003,Sarten De Hierro Fundido 19 Cm Con Asas Rectangular Cocina,bla,gris,Cocina,19920,29
KMEM35,Escalera Multiposiciones De Aluminio 3.5 Metros 12 Peldaños,bla,gris,Ferretería,19490,40
52478-BEST,Tobogan Resbaladero Deslizador Tsunami Splash Doble Bestway,bla,gris,Jardín,19470,87
2198410-CON,Taza Termica Termo Contigo Rambler + Tapa Caliente Frio 14oz,bla,gris,Jardín,19140,255
TOLIXKIT#2-BA2ROJ,NULL,bla,gris,Muebles,18990,0
TOLIXKIT#2-BA2NEM,NULL,bla,gris,Muebles,18990,0
2158134,Hielera Flexible CHILLER SOFT COOLER 9 Latas Coleman,bla,gris,Deportes,18760,73
2201793-CON,Termo Para Agua 40oz 1.18Lt Acero Inox Streeterville Contigo,bla,gris,Hogar,18515,176
KINGSTVCABINET3,Rack Mueble para TV con Soporte 32-65 107x40x40 cm Gris ZTM-03A KingsHouse,bla,gris,Muebles,18392,0
56493NP-INTEX,Piscina Alberca Inflabel Piscina Hexagonal Oceano Niño Intex,bla,gris,Jardín,17980,39
58786EU-INTEX,Alas De Angel Colchon Inflable Para Alberca Playa Intex,bla,gris,Jardín,17980,38
2156382,Hielera Personal Tipo Mochila 6 Latas Azul Coleman,bla,gris,Deportes,17960,73
ADP06-MAK,Fuente de Energía Inalámbrica CXT Litio‑Ion de 12V max ADP06 Makita,bla,gris,Ferretería,17955,45
BEDRM3-NOG,Juego de dormitorio ropero comoda y buro,bla,gris,Muebles,17495,0
KINGBIFI13,Bicicleta Fija 13 kg Estática Para Spinning Cardio Fitness,bla,gris,Deportes,17495,1
TOLIXKIT#2-BA2BLA,NULL,bla,gris,Muebles,16990,0
TOLIXKIT#2-CLA1BLA,NULL,bla,gris,Muebles,16490,0
TOLIXKIT#2-CLA1NEM,NULL,bla,gris,Muebles,16490,0
TOLIXKIT#2-CLA1ROJ,NULL,bla,gris,Muebles,16490,0
52278-BEST,Centro De Juego Inflable Infantil Excavadora Mobible Bestway,bla,gris,Jardín,16380,44
KINGCHEST2G,Comoda Cajonera con 2 Cajones Buro Mueble de Tela Madera,bla,gris,Muebles,16225,26
2180607,Termo PRO SS Jarra 1/2 Galon Coleman,bla,gris,Deportes,16180,19
TOLIXKIT#4-CLA2BLA,NULL,bla,gris,Muebles,15995,0
2158117,Hielera Personal 30 Latas Coleman Mochila Portátil Negro,bla,gris,Deportes,15980,51
58412NP-INTEX,Cobertor Rectangular Para Albercas Campismo 305x183 Cm Intex,bla,gris,Jardín,15920,143
58883NP-INTEX,Colchon Asiento Inflable Para Alberca 2colores 58883np Intex,bla,gris,Jardín,15160,35
DREAMSCOVERSG,Edredon C/Funda de Almohada Individual,bla,gris,Hogar,15160,49
2158119,Hielera Flexible CHILLER SOFT COOLER 16 Latas Coleman,bla,gris,Deportes,14970,44
300597,Caja de Llaves para 36 Llaves de 30 cm Combinacion Ts0057 Kingsman,bla,gris,Otros,14760,158
2158645,Termo de 1 Galon Chiller Azul 2158645 Coleman,bla,gris,Jardín,14760,0
2158133,Hielera Mochila CHILLER SOFT COOLER 28 Latas Coleman,bla,gris,Deportes,14380,20
43421-BEST,Flotador Para Alberca Inflable Acuatico Salvavida Bestway,bla,gris,Jardín,14360,81
300552,Silla Tipo Eames Madera Tulip Asiento Acolchonado Vinipiel,bla,gris,Muebles,13980,2
2186459-CON,Termo Botella 12oz Para Niños Con Popote Acero Inox Leighton,bla,gris,Hogar,13960,90
300544,Lupa Escritorio con Luz 100 mm 3x con Prensa 5 cm Color Negro Kingsman,bla,gris,Ferretería,13960,98
1700843-LIB,Decantador Oxigenador Aireador Vidrio De Vino 1.9 L Libbey,bla,gris,Cocina,13960,90
HJSBSB010001,Sombrilla Para Jardin Exterior Plegable 3mts Con Inclinacion,bla,gris,Jardín,13794,0
2186457-CON,Termo Botella 12oz Para Niños Con Popote Acero Inox Leighton,bla,gris,Hogar,13560,80
300564,Termometro Laser Infrarojo -50 A 380 Grados 405151 Kingsman,bla,gris,Ferretería,13560,188
XMASLIGHT450,LUCES DE NAVIADA LED 450 CALIDAS,bla,gris,Hogar,13160,122
COLORBOARD3,Juego de Tablas Cocina para Picar Alimentos de Plástico 3 Piezas COLORBOARD3 ColorHome,bla,gris,Cocina,13080,444
29057-INTEX,Kit Limpieza Hojas Alberca Piscina+ Cepillo + Cabezal Intex,bla,gris,Jardín,12980,42
70290-CON,Botella Contigo Shaker Mezcladora 28 Oz Vaso Fitness Deporte,bla,gris,Jardín,12900,312
DREAMSCOVERSI,Edredon C/Funda de Almohada Individual,bla,gris,Hogar,12886,34
300152,Juego 15 Brocas Carburo 1/4 Para Router Estuche Madera,bla,gris,Ferretería,12760,441
CE1GVOLT,Calefactor Ventilador Calentador Electrico 1500W Portatil,bla,gris,Electrodomésticos,11970,32
2000034753,Hielera Flexible Termica 9 Latas 16 Horas Frio Coleman,bla,gris,Jardín,11960,38
2000034754,Hielera Flexible Termica 18 Latas 20 Horas Frio Coleman,bla,gris,Jardín,11960,0
2195204-CON,Botella agua plástica 14 Oz Sistema AUTOSPOUT 2195204 Contigo,bla,gris,Jardín,11960,97
300230,Prensa Esquinera Uso Rudo 65mm Herramienta Carpinteria Marco,bla,gris,Ferretería,11960,101
HJ3P3P010001,Paquete De 3 Plantas Pequeñas Artificiales Decoracion Hogar,bla,gris,Hogar,11940,483
MAGNEKING5KIT,Kit 2 Escuadras Magnetica 5 In 50 Lb 34 Kg Juego Para Soldar,bla,gris,Ferretería,11920,91
DREAMSDUOMIXQ,Pack duo 2 Almohadas Mix Estándar DREAMSDUOMIXQ ColorDreams,bla,gris,Colchones,11866,25
300241,Kit 18 Brocas Puntas Plantilla Guia Conexión Rapida Taladro,bla,gris,Ferretería,11560,80
HJWCWA010000,Closet Ropero Armable Armario 4 A 6ft Ajustable Reforzado,bla,gris,Hogar,11557,24
28032-INTEX,Cubierta Cobertor Tapa Para Alberca Estructural 457 Cm Intex,bla,gris,Jardín,11370,19
2162082-CON,Botella agua plástica 14 Oz Sistema AUTOSPOUT 2195204 Contigo,bla,gris,Jardín,11160,53
57141NP-INTEX,Alberca Inflable Nube Techo Arcoiris De Bebe Hogar Intex,bla,gris,Jardín,11070,78
300262-NEG,Caja De Dinero Sencilla 20 Cm Para Monedas Kingsman,bla,gris,Ferretería,11026,55
43555-BEST,Flotador Para Alberca Inflable Acuatico Con Cabecera Bestway,bla,gris,Jardín,10760,69
58753EU-INTEX,Inflable Colchoneta Forma Paleta Para Alberca 58753eu Intex,bla,gris,Jardín,10580,54
2100871-CON,Termo Acero Inox Sistema Snapseal Byron 473 Ml Contigo,bla,gris,Jardín,10470,30
2181410-CON,Termo Botella 12oz Para Niños Con Popote Acero Inox Leighton,bla,gris,Hogar,10470,62
300264,Caja De Seguridad 30cm Guardar Dinero Monedas 9 Separadores,bla,gris,Otros,10360,52
KINGCHEST5-1,Comoda Cajonera 5 Cajones Mueble Organizador de Tela Madera,bla,gris,Muebles,9990,19
DPMCMN000001,Par De Mancuernas Cromadas,bla,gris,Deportes,9980,42
CE1BVOLT,Calefactor Portatil Calentador Electrico Ventilador 1500W,bla,gris,Electrodomésticos,9975,201
300280,Caja De Valor Forma De Libro Plastico 18 Cm Con Combinacion,bla,gris,Otros,9960,522
COLORSTEEL5N,SETX3 SARTENES ANTIADHERENTE + UTENSILLIO DE NYLON,bla,gris,Cocina,9960,259
COLORSTEEL5R,SETX3 SARTENES ANTIADHERENTE + UTENSILLIO DE NYLON,bla,gris,Cocina,9960,250
BAMBYBOOSTG,Asiento Elevador Coche Para Bebe Booster Carro Cojin Silla,bla,gris,Bebés,9960,101
D-37100-MAK,Brocas Juego 5pzs Multimaterial Ideal Madera Aluminio Makita,bla,gris,Ferretería,9900,582
2000035540,Bolsa De Dormir Coleman Saco Sleeping Bag 187x72cm Colores,bla,gris,NULL,9580,25
B-90467-MAK,Set Discos Para Esmeril Corte Desbaste Pulido 4 Pzas Makita,bla,gris,Ferretería,9560,81
DREAMSCOVERSC,Edredon C/Funda de Almohada Individual,bla,gris,Hogar,9475,15
300194-SZ,Mueble Armario Closet Multiuso 2 Puertas + Estantes Mdp Casa,bla,gris,Muebles,9196,0
HJSBSB140001,Sombrilla Para Jardin Exterior Plegable 3mts Con Inclinacion,bla,gris,Jardín,9196,2
300293,Kit Herramienta Relojero Joyero Reparaciones 146 Pzs Estuche,bla,gris,Ferretería,9160,186
COLORSTEEL4R,SETX3 SARTENES ANTIADHERENTE + UTENSILLIO DE NYLON,bla,gris,Cocina,9160,98
2094848-CON,Termo 16oz 473 Ml Acero Inox Frio Caliente Para Cafe Contigo,bla,gris,Jardín,8970,34
KINGMSK50,Careta Electronica Para Soldar Uso Industrial 9-13 Kingsman,bla,gris,Ferretería,8450,516
2126115-CON,Botella Contigo 414 Ml 14 Oz Autospout Agua Niños Infantil,bla,gris,Jardín,8015,94
29005-INTEX,Cartucho Filtrante Tipo B Bomba De 2000 A 4000 Gph Intex,bla,gris,Jardín,7960,118
300326,Herramienta Matraca Dado Hexagonal Universal 1/4-3/4in 3 Pzs,bla,gris,Ferretería,7960,266
606-BLK-PTY-BCH,Engrapadora de Escritorio Deluxe,bla,gris,Ferretería,7960,83
300156,Llave 4En1 Para Esmeril Angular Capacidad 15-52mm Universal,bla,gris,Ferretería,7920,635
300285,Caja Dinero de Combinación Negro 20x16x9 cm Ts0037 Kingsman,bla,gris,Otros,7560,7
BAMBYBOOSTGN,Asiento Elevador Coche Para Bebe Booster Carro Cojin Silla,bla,gris,Bebés,7470,44
300161,Kit Desarmador Desatornillador Reparacion Celular Punta 63pz,bla,gris,Ferretería,7160,184
KINGCHEST5-1BWB,Comoda Cajonera 5 Cajones Mueble Organizador de Tela Madera,bla,gris,Muebles,6993,0
300453,Accesorio para Taladro Mototool Juego con 250 Pcs 402083 Kingsman,bla,gris,Ferretería,6980,708
COLORJAR5,Dispensador Bebidas 5 Litros Mason Jar Vitrolero Base Metal,bla,gris,Cocina,6780,6
2121050-CON,Termo 16 Oz Autoseal WestLoop 3.0 Acero Inoxidable Contigo,bla,gris,Hogar,6580,54
2198369-CON,Termo 16oz Luxe Travel Blueberry Contigo,bla,gris,Hogar,6580,51
2198406-CON,Taza Termica Termo Contigo Rambler + Tapa Caliente Frio 14oz,bla,gris,Jardín,6380,22
300160,Desarmador Kit Reparacion Celulares Tablets Laptops 117 En 1,bla,gris,Ferretería,6380,307
300563,Follaje Artificial Sintetico Muro Verde 60x40cm Hoja Grande,bla,gris,Jardín,6360,25
300265,Caja Dinero de Combinación con Perilla 20x16x9 cm Negro Ts0037G Kingsman,bla,gris,Otros,6270,110
300266,Caja De Guardar Dinero Combinacion 25x18x9 Cm 3 Separadores,bla,gris,Otros,5970,46
300330,Punzon Letra y Número Juego con 36 Piezas 4 mm Kingsman,bla,gris,Ferretería,5970,83
300225,Guia Plantilla V Angulos Brocas 4-12 Mm Carpinteria Madera,bla,gris,Ferretería,5960,181
300158,Cepillo para Taladro Juego 3 Piezas para Limpieza Cerdas Multiusos 300158 Kingsman,bla,gris,Ferretería,5960,78
CHRACK1,Organizador Estante de Ollas y Sartenes 3 Repisas Acero 43 cm LFZH011 ColorHome,bla,gris,Muebles,5580,69
KINGCHEST5GB,Comoda Cajonera de 5 Cajones Mueble Organizador Tela Madera,bla,gris,Muebles,5495,33
300159,Kit Cepillo Escobilla De Taladro 10 Pzs Nailon Limpieza Baño,bla,gris,Ferretería,5380,15
29020-INTEX,Cubierta Para Albercas Easy Set Y Estructural 244 Cm Intex,bla,gris,Jardín,5370,72
58095-BEST,Cartucho Tipo Iv Bestway Filtro Para Bomba Limpieza Alberca,bla,gris,Jardín,5340,18
CEC2GVOLT,Calefactor Electrico De Cuarzo 800W Calentador 2 Niveles,bla,gris,Electrodomésticos,5229,85
300232,Chupon Succionador Para Sacar Abolladuras Levanta Carga 5 Kg,bla,gris,Ferretería,5160,157
300277,Caja Valor Camuflaje Forma De Libro Plastico 18 Cm,bla,gris,Otros,4980,51
66635-INTEX,Bomba de Aire de Carga Rapida Mini USB Intex,bla,gris,Jardín,4780,47
1720743-LIB,Vasos Buzz Lightyear Juego 4 Pzas 260ml Colores Para Niños,bla,gris,Cocina,4580,18
COLORSTEEL4N,SETX3 SARTENES ANTIADHERENTE + UTENSILLIO DE NYLON,bla,gris,Cocina,4580,54
58319-BEST,Cobertor Tapa Cubierta De Alberca Bestway Rectangular 262cm,bla,gris,Jardín,4475,110
BSHD02160001,Difusor Humidificador Usb,bla,gris,Salud,4475,116
DPCPCP020001,Cojín Almohadilla Para Sentadillas Barra Pesas Gym Protector,bla,gris,Deportes,4225,142
59895NP-INTEX,Flotador Colchon Inflable Para Alberca Surtido 59895np Intex,bla,gris,Jardín,4180,44
300584,Escuadra Magnetica Para Soldar 6 Pzs Esquina 30 a 135 Grados,bla,gris,Ferretería,4170,36
2186456-CON,Termo Botella 14oz Para Niños Popote PVC Leigthon Contigo,bla,gris,Hogar,3980,51
51-471-STA,Martillo Curvo Mango de Madera 16 oz,bla,gris,Ferretería,3980,58
300144,Prensa Sargento Tipo F 6 In X 6 Cm Ajuste Rapido Carpinteria,bla,gris,Ferretería,3960,4
VWINE18,Cava De Vinos Para 18 Botellas VWINE18 VOLTIO,bla,gris,Electrodomésticos,3899,0
KHMESAX4SMCG,Sillas Juego De Comedor Con Mesa Cocina Cafeteria 4 Personas,bla,gris,Muebles,3749,54
2169253-CON,Termo Acero Inox Sistema Snapseal Byron 710 Ml Contigo,bla,gris,Jardín,3592,0
2094863-CON,Termo 20oz 591 Ml Tipo Taza Acero Inox Frio Caliente Contigo,bla,gris,Jardín,3591,14
2608619383-BOS,Disco Abrasivo de Corte para Metal 4 1/2 In 2608619383 Bosch,bla,gris,Ferretería,3570,76
300147,Prensa Sargento Para Madera de 24 Pulgadas Carpinteria,bla,gris,Ferretería,3570,25
DPCSCS000001,Cuerda Para Saltar Mango Antideslizante 300 cm Ajustable,bla,gris,Deportes,3560,490
DPCSCS030001,Cuerda Para Saltar Mango Antideslizante 300 cm Ajustable,bla,gris,Deportes,3560,347
DPCSCS020001,Cuerda Para Saltar Mango Antideslizante 300 cm Ajustable,bla,gris,Deportes,3560,458
SBCLOUDG,Sofa cama sillon colchon plegable Individual ColorDreams,bla,gris,Colchones,3499,0
KINGCHEST2B,Comoda Cajonera con 2 Cajones Buro Mueble de Tela Madera,bla,gris,Muebles,3245,3
KINGCHEST2,Comoda Cajonera con 2 Cajones Buro Mueble de Tela Madera,bla,gris,Muebles,3245,0
2144598-CON,Taza Termica Termo Contigo Rambler + Tapa Caliente Frio 14oz,bla,gris,Jardín,3190,4
BSOMES110001,Organizador De Labiales Organizador De Acrilico Con Espejo,bla,gris,Belleza y Cuidado Personal,2980,32
HJPA12050001,Paquete 5 Plantas Artificiales Tropicales Falsas Codiaeum,bla,gris,Hogar,2970,70
HJPA19050001,Paquete 5 Plantas Tropicales Falsas Artificiales Epipremnum,bla,gris,Jardín,2760,0
ALEBRIBOXPROG,Arenero Cerrado Para Gato Doble Entrada 52x39x40cm Alebripets,bla,gris,Mascotas,2396,1
DPCPCP000001,Cojín Almohadilla Para Sentadillas Barra Pesas Gym Protector,bla,gris,Deportes,2197,5
2144597-CON,Taza Termica Termo Contigo Rambler + Tapa Caliente Frio 14oz,bla,gris,Jardín,1595,6
2144612-CON,Taza Termica Termo Contigo Rambler + Tapa Caliente Frio 14oz,bla,gris,Jardín,1595,19
COLORJAR1-5,Contenedor para Almacenaje Cristal con Tapa Hermetica 1.5 Litros COLORJAR1-5 ColorHome,bla,gris,Cocina,990,1
2144613-CON,Taza Termica Termo Contigo Rambler + Tapa Caliente Frio 14oz,bla,gris,Jardín,638,0
